{"review_version":1,"session_id":"R-example","mode":"wrong_answer_review","answer_revealed":true,"items":[{"question_id":"q1","question_number":1,"question_type":"multiple_choice_single","user_answer":"A","correct_answer":"B","evidence_location":"Paragraph B","evidence":"The paragraph states the opposite relationship.","reasoning":"B matches the stated cause.","distractors":[{"option":"A","reason":"It reverses cause and effect."}],"error_tags":["reading_logic_reversal"],"next_rule":"Check the direction of the relationship."}],"next_action":"Redo one matching-evidence item."}
